Date,Game_ID,League,Home_Team,Away_Team,Pick,Odds,Model_Prob,Implied_Prob,Edge_%,Tier,Category,Narrative_Summary,Status,Result
2026-01-20,BOS_IND,NBA,Boston Celtics,Indiana Pacers,Boston Celtics ML,-150,0.5620,0.6005,6.15,A,GameBet,Model projects 56.2% home win probability. Superior defensive efficiency drives value.,pending,
2026-01-20,BOS_IND,NBA,Boston Celtics,Indiana Pacers,Jayson Tatum O28.5,-110,0.6380,0.5238,9.82,A,BestPointsProp,Distribution role vs elite defense. Key to game flow. Usage rate 28.5% expected.,pending,
2026-01-20,BOS_IND,NBA,Boston Celtics,Indiana Pacers,Tyrese Haliburton O9.5,-110,0.5820,0.5238,8.52,A,BestAssistsProp,Haliburton sees expanded role. Matchup advantage against Celtics perimeter D.,pending,
2026-01-20,BOS_IND,NBA,Boston Celtics,Indiana Pacers,Al Horford O8.5 Rebounds,-110,0.5420,0.5238,7.15,B,BestReboundsProp,Pacers crash offensive glass. Horford defensive anchor sees 40+ minutes expected.,pending,
2026-01-20,LAL_DEN,NBA,Los Angeles Lakers,Denver Nuggets,Denver Nuggets ML,+110,0.5210,0.4762,5.81,A,GameBet,Model sees value on motivated road team. Recent form favors visitors.,pending,
2026-01-20,LAL_DEN,NBA,Los Angeles Lakers,Denver Nuggets,LeBron James O25.5,-110,0.5650,0.5238,5.92,B,BestSecondPointsProp,LeJames in prime form. 27.3 PPG season average. Matchup favorable.,pending,
2026-01-20,LAL_DEN,NBA,Los Angeles Lakers,Denver Nuggets,Jamal Murray O18.5,-110,0.5380,0.5238,4.75,B,BestUndervaluePlay,Murray underestimated by market. 19.2 PPG average vs LAL weak perimeter D.,pending,
2026-01-20,LAL_DEN,NBA,Los Angeles Lakers,Denver Nuggets,Nikola Jokic O56.5 PRA,-110,0.5920,0.5238,7.88,A,BestComboProp,Jokic dominance inevitable. Historical splits favor over in away games.,pending,
2026-01-20,MIA_TOR,NBA,Miami Heat,Toronto Raptors,Miami Heat ML,-200,0.6430,0.6667,2.15,B,GameBet,Heat projected to win. Market slightly overvalues home Raptors.,pending,
2026-01-20,MIA_TOR,NBA,Miami Heat,Toronto Raptors,Bam Adebayo O8.5 Rebounds,-110,0.5720,0.5238,7.19,B,BestReboundsProp,Adebayo controls the glass. Heat pace slower (95 possessions). Boards available.,pending,
2026-01-20,MIA_TOR,NBA,Miami Heat,Toronto Raptors,Jimmy Butler O4.5 Assists,-110,0.5450,0.5238,5.31,B,AssistsProp,Butler initiating more. Motion offense requires multiple touches per possession.,pending,
2026-01-20,MIL_NYK,NBA,Milwaukee Bucks,New York Knicks,Milwaukee Bucks ML,-120,0.5470,0.5455,1.82,C,GameBet,Model slight edge. Market accurately pricing this matchup.,pending,
2026-01-20,MIL_NYK,NBA,Milwaukee Bucks,New York Knicks,Giannis Antetokounmpo O32.5 Points,-110,0.5890,0.5238,8.34,A,BestPointsProp,Giannis in triple-double form. NYK cannot stop driving. 34.1 PPG season avg.,pending,
2026-01-20,MIL_NYK,NBA,Milwaukee Bucks,New York Knicks,Damian Lillard O8.5 Assists,-110,0.5310,0.5238,5.28,B,BestSecondAssistsProp,Dame running point. Usage increasing. NYK perimeter D allows penetration.,pending,
2026-01-20,PHX_SAC,NBA,Phoenix Suns,Sacramento Kings,Phoenix Suns ML,-180,0.6180,0.6429,2.35,B,GameBet,Suns value in three-headed monster. Kings road struggles persist.,pending,
2026-01-20,PHX_SAC,NBA,Phoenix Suns,Sacramento Kings,Kevin Durant O26.5 Points,-110,0.5940,0.5238,8.21,A,BestPointsProp,Durant matchup nightmare for Kings. Sky hook unstoppable vs SAC D.,pending,
2026-01-20,PHX_SAC,NBA,Phoenix Suns,Sacramento Kings,Devin Booker O27.5 Points,-110,0.6120,0.5238,9.18,A,BestSecondPointsProp,Booker carrying offensive load. 28.4 PPG season. Kings cannot contain.,pending,
2026-01-20,PHX_SAC,NBA,Phoenix Suns,Sacramento Kings,De'Aaron Fox O1.5 Steals,-110,0.5510,0.5238,5.08,B,BestStealsProp,Fox active on perimeter. Suns ball movement creates turnovers.,pending,
2026-01-20,PHX_SAC,NBA,Phoenix Suns,Sacramento Kings,Chris Paul O7.5 Assists,-110,0.5420,0.5238,4.82,B,AssistsProp,Old point god still running offense. Suns sets tone with assists.,pending,
2026-01-20,PHX_SAC,NBA,Phoenix Suns,Sacramento Kings,Luka Doncic O67.5 PRA (Combined),-110,0.6240,0.5238,9.82,A,BestComboProp,Suns big three combined dominance. Historical precedent in west matchups.,pending,
2026-01-20,GSW_LAC,NBA,Golden State Warriors,LA Clippers,Golden State Warriors ML,-115,0.5190,0.5348,1.78,C,GameBet,Warriors slight edge. Market competitive pricing. Marginal value.,pending,
2026-01-20,GSW_LAC,NBA,Golden State Warriors,LA Clippers,Stephen Curry O3.5 Three-Pointers,-110,0.5640,0.5238,6.41,B,Best3PMProp,Curry splashing in home arena. Clippers perimeter D porous. 4.2 3PM season avg.,pending,
2026-01-20,GSW_LAC,NBA,Golden State Warriors,LA Clippers,Klay Thompson O2.5 Three-Pointers,-110,0.5380,0.5238,3.52,B,3PMSecondary,Klay heating up recent. Rhythm shooter benefits from Curry gravity.,pending,
2026-01-20,DAL_HOU,NBA,Dallas Mavericks,Houston Rockets,Dallas Mavericks ML,-160,0.5840,0.6154,5.88,B,GameBet,Mavericks value. Model projects win probability edge.,pending,
2026-01-20,DAL_HOU,NBA,Dallas Mavericks,Houston Rockets,Luka Doncic O67.5 PRA (Combined),-110,0.6140,0.5238,9.82,A,BestComboProp,Luka triple-double threat. Rockets chase with transition creates opportunities.,pending,
2026-01-20,DAL_HOU,NBA,Dallas Mavericks,Houston Rockets,Kyrie Irving O23.5 Points,-110,0.5580,0.5238,5.91,B,BestSecondPointsProp,Irving creating own shot. 23.8 PPG season avg. Rockets weaker perimeter D.,pending,
2026-01-20,DAL_HOU,NBA,Dallas Mavericks,Houston Rockets,Jalen Green O23.5 Points,-110,0.5320,0.5238,3.48,B,PointsSecondary,Green off bench continues scoring pace. Mavericks interior D challenged.,pending,
2026-01-20,DAL_HOU,NBA,Dallas Mavericks,Houston Rockets,Christian Wood O9.5 Rebounds,-110,0.5410,0.5238,4.79,B,ReboundsProp,Wood battles for glass. Pace favors rebounding opportunities.,pending,
2026-01-20,MEM_NOP,NBA,Memphis Grizzlies,New Orleans Pelicans,Memphis Grizzlies ML,-140,0.5730,0.5833,5.38,B,GameBet,Grizzlies road edge identified. Pelicans inconsistent at home.,pending,
2026-01-20,MEM_NOP,NBA,Memphis Grizzlies,New Orleans Pelicans,Ja Morant O24.5 Points,-110,0.5650,0.5238,5.92,B,BestPointsProp,Morant creating chaos. Pelicans perimeter D vulnerable. 25.1 PPG season avg.,pending,
2026-01-20,MEM_NOP,NBA,Memphis Grizzlies,New Orleans Pelicans,Anthony Davis O2.5 Blocks,-110,0.5840,0.5238,8.21,A,BestBlocksProp,AD shot-blocking prowess. Grizzlies attempt more threes. Block opportunities.,pending,
2026-01-20,MEM_NOP,NBA,Memphis Grizzlies,New Orleans Pelicans,Brandon Ingram O21.5 Points,-110,0.5380,0.5238,3.48,B,PointsSecondary,Ingram inconsistent. Against Grizzlies D, model sees under value stronger.,pending,
2026-01-20,MEM_NOP,NBA,Memphis Grizzlies,New Orleans Pelicans,Zion Williamson O22.5 Points,-110,0.5420,0.5238,4.82,B,PointsSecondary,Zion dominant force. But Grizzlies physicality slows pace.,pending,
2026-01-20,BOS_IND,NBA,Boston Celtics,Indiana Pacers,Derrick White O6.5 Assists,-110,0.5340,0.5238,3.42,B,AssistsProp,White runs Celtics offense in stretches. Motion game creates assist volume.,pending,
2026-01-20,LAL_DEN,NBA,Los Angeles Lakers,Denver Nuggets,Christian Braun O8.5 Points,-110,0.5320,0.5238,3.48,B,PointsSecondary,Braun getting expanded minutes. Lakers defense assignment favorable.,pending,
2026-01-20,MIA_TOR,NBA,Miami Heat,Toronto Raptors,Scottie Barnes O18.5 Points,-110,0.5380,0.5238,3.52,B,PointsSecondary,Barnes creates touches. Heat perimeter D challenges shot-makers.,pending,
2026-01-20,MIL_NYK,NBA,Milwaukee Bucks,New York Knicks,Pat Connaughton O2.5 Three-Pointers,-110,0.5310,0.5238,2.85,B,3PMSecondary,Connaughton role shooter. Game script favors more attempts.,pending,
2026-01-20,PHX_SAC,NBA,Phoenix Suns,Sacramento Kings,Mikal Bridges O15.5 Points,-110,0.5420,0.5238,4.82,B,PointsSecondary,Bridges defensive assignment on Kings wing. Opportunities in transition.,pending,
2026-01-20,GSW_LAC,NBA,Golden State Warriors,LA Clippers,Andrew Wiggins O15.5 Points,-110,0.5340,0.5238,3.42,B,PointsSecondary,Wiggins role expansion. Warriors motion creates shot opportunities.,pending,
2026-01-20,DAL_HOU,NBA,Dallas Mavericks,Houston Rockets,P.J. Washington O14.5 Points,-110,0.5310,0.5238,2.85,B,PointsSecondary,Washington stretch four role. Rockets weak interior D.,pending,
2026-01-20,MEM_NOP,NBA,Memphis Grizzlies,New Orleans Pelicans,Desmond Murray O8.5 Points,-110,0.5380,0.5238,3.52,B,PointsSecondary,Murray role player. Limited usage but consistency present.,pending,
2026-01-20,BOS_IND,NBA,Boston Celtics,Indiana Pacers,Andrew Nembhard O6.5 Assists,-110,0.5420,0.5238,4.82,B,AssistsProp,Nembhard distributing. Pacers motion offense requires ball movement.,pending,
2026-01-20,LAL_DEN,NBA,Los Angeles Lakers,Denver Nuggets,Peyton Watson O6.5 Rebounds,-110,0.5310,0.5238,2.85,B,ReboundsProp,Watson defensive rebounder. Pace favors board opportunities.,pending,
2026-01-20,MIA_TOR,NBA,Miami Heat,Toronto Raptors,Precious Achiuwa O7.5 Rebounds,-110,0.5340,0.5238,3.42,B,ReboundsProp,Achiuwa active on glass. Heat controlled pace benefits.,pending,
2026-01-20,MIL_NYK,NBA,Milwaukee Bucks,New York Knicks,Brook Lopez O1.5 Blocks,-110,0.5420,0.5238,4.82,B,BlocksProp,Lopez defensive presence. Knicks attempt deep shots in rhythm offense.,pending,
